한준혁,경기도 의정부시 양재천가 (지훈이읍),96708,류황,보건의료관련 관리자,044-486-6336,yeongja11@example.net,go,10.45.143.228,24.156.117.255,적응된 필수 엔진,DarkGoldenRod
이은주,대전광역시 남구 삼성49로 (명자최면),67113,유한회사 차,가수 및 성악가,051-379-3912,seonyeongryu@example.org,juweoni,172.29.38.249,217.220.236.12,단체 기반의 3세대 엔진,MediumSeaGreen
구민재,울산광역시 강북구 잠실296거리 (성진심동),44271,이오,위관급,062-157-7795,yujin82@example.net,mseo,10.50.139.200,95.87.192.238,중심이 컨텐츠 기반 알고리즘,DarkRed
박영철,부산광역시 영등포구 양재천6길 (수빈이마을),30549,배이,안마사,062-675-4366,qbag@example.org,iyunseo,192.168.3.223,191.227.243.238,미래가 보장된 24시간 프로젝트,DarkOrange
남정숙,제주특별자치도 동두천시 테헤란거리 (지훈박면),64865,김진,화물차 및 특수차 운전원,016-405-9769,myeongjagim@example.org,fbag,172.16.208.192,169.151.33.0,융합력있는 지역적 엔진,RosyBrown
윤현주,경기도 양양군 도산대3로,17939,(유) 김이곽,교육 관리자,042-562-2659,gimsujin@example.net,jihyegim,172.16.196.184,160.80.188.174,강화된 하이브리드 인트라넷,DarkTurquoise
이유진,광주광역시 광진구 반포대231가 (경희김김면),84489,박김,정부 및 공공 행정 전문가,02-6298-5272,yeonggili@example.org,jeongsugi,172.17.21.157,71.14.56.54,인체 공학적인 고도 기반 데이터베이스,LightSalmon
강지우,전라북도 정선군 삼성34가 (성수김문리),94964,안김,기타 공학관련 기술자 및 시험원,042-001-5914,miyeong42@example.com,myeongja03,192.168.103.223,205.220.179.115,단체 기반의 무관용 웹 사이트,OldLace
김은지,전라북도 천안시 동남구 양재천16로 (경수김허읍),00787,주식회사 박,기타 전기/전자기기 설치 및 수리원,010-7388-5264,lgim@example.net,jeongminjun,192.168.3.75,5.60.253.101,최적화된 보조 안내 창구,LightGreen
양경자,대구광역시 중랑구 언주거리 (경수안김면),01992,오김,임상 심리사 및 기타 치료사,010-2742-1590,ujin58@example.net,lno,192.168.119.67,52.206.32.215,적응된 객체 지향적 공개 시스템,DeepPink
윤영순,울산광역시 구로구 테헤란거리 (민석박이마을),36860,이황,경기심판 및 경기기록원,032-892-8415,jihunryu@example.net,myeongsug68,10.60.103.8,59.204.68.212,더 작아진 가치추가 표준,Indigo
백은서,충청남도 용인시 삼성길 (지은문리),41698,김이,경기심판 및 경기기록원,011-412-5350,caeweongo@example.org,eunjimun,192.168.179.40,195.36.22.115,관리된 근본적 연합,Gray
문미영,대전광역시 양천구 잠실길 (정희이백리),73705,주식회사 김,섬유공학 기술자 및 연구원,010-2576-4896,jeongnamhwang@example.net,dohyeon61,192.168.42.104,193.76.121.105,공개 키 결정 LAN,FireBrick
장경수,충청북도 진천군 논현길 (승민김배읍),25929,주황김,작가 및 관련 전문가,010-6051-2349,tjang@example.org,minjun50,10.68.168.65,174.147.1.235,다양한 객체 지향적 그래픽 인터페이스,Violet
손민석,경기도 태안군 강남대4로,77314,유한회사 김최허,상품 대여원,031-591-3612,rbag@example.org,hongmyeongja,10.255.118.255,124.93.133.157,다중 주파수 무해한 정의,Green
김정남,광주광역시 동구 학동65길 (민수심배동),16302,김류,목제품 제조관련 종사원,051-813-8017,djang@example.net,ijeongsun,192.168.2.4,128.25.194.60,확대된 중립형 성공,DarkOrchid
양준호,제주특별자치도 태안군 선릉099길 (선영이동),72487,유한회사 노,초등학교 교사,032-115-4410,myeongja02@example.com,wi,172.17.73.117,163.135.74.122,진보적인 분리된 인터페이스,DarkCyan
양영철,부산광역시 관악구 봉은사길 (진호송서리),33903,주식회사 한,기타 사무원,064-787-6092,ysong@example.com,gimyujin,192.168.8.75,163.138.219.241,완벽히 설정된 다이나믹 소프트웨어,DarkOliveGreen
이지원,경상북도 시흥시 논현126거리 (은주배면),54074,(주) 김양나,광석 및 석제품 가공기 조작원,053-723-0923,yeongjagwag@example.net,ijihu,192.168.120.65,208.234.22.169,비전 있는 분리형 회로,Gainsboro
이유진,광주광역시 서구 도산대925로,09284,박최황,기계공학 기술자 및 연구원,018-959-5340,songminjun@example.net,jaehyeon64,192.168.156.199,177.194.255.246,멀티 채널 최대화 관리자,DarkKhaki
윤지후,충청남도 김포시 반포대270가,75185,유한회사 박류김,재봉사,031-215-0019,hyeonsugyun@example.org,seongsu29,172.23.207.122,165.105.21.151,가상 멀티미디어 태도,MistyRose
최종수,대구광역시 강남구 압구정287가 (보람이마을),39171,(유) 박김김,자동차 정비원,043-926-8460,jiweonjeong@example.net,jiyeonim,192.168.64.1,148.150.188.26,변경 가능한 범국가적 모델,Pink
류예진,강원도 동두천시 삼성가,19049,유한회사 김,냉/난방 관련 설비 조작원,042-265-2088,bagjeongsug@example.org,jeonghogim,10.234.160.92,201.175.64.222,오픈소스 휴대형 배열,PeachPuff
김지은,충청남도 금산군 개포6거리 (지우이이읍),34244,주식회사 이,승강기 설치 및 정비원,043-394-6619,yunsujin@example.com,jieun19,172.30.96.78,15.77.34.217,진보적인 클라이언트-서버 표준,SeaShell
한경수,충청북도 김포시 양재천가,97837,김배장,기타 직물 및 신발 관련 기계조작원 및 조립원,055-685-4562,jeongjana@example.org,mbaeg,10.76.201.86,197.3.242.44,미래가 보장된 상황에 맞는 환경,LightSalmon
진정숙,제주특별자치도 용인시 서초중앙길,93643,차황,영양사,041-017-5086,ijihu@example.org,di,192.168.112.209,70.252.60.62,공유 가능한 확장 고객 만족,Gray
송정남,경기도 연천군 양재천거리,90232,김이,신발제조기 조작원 및 조립원,011-772-4743,rgim@example.org,ggim,172.16.9.194,190.70.23.195,융합된 해답 기반 배열,DarkOrchid
박순옥,세종특별자치시 남구 도산대길,84820,주식회사 이김박,통신서비스판매원,041-346-2416,tbag@example.com,dohyeonbag,192.168.197.121,198.237.104.4,조직화된 합성물 정책,Coral
박종수,충청북도 부천시 원미구 역삼거리,10721,김김김,장기 부사관 및 준위,055-880-4016,ugim@example.com,seoyeongbag,10.81.64.111,183.248.249.91,다중 주파수 분리형 프로토콜,LightSeaGreen
김은지,세종특별자치시 마포구 논현7거리 (춘자김동),27656,이장황,기타 경호 및 보안 관련 종사원,016-965-1963,borami@example.org,gyeongsug39,10.137.173.248,142.232.4.176,총 무해한 공구,SlateGray
